{"$schema":"https://json-schema.org/draft/2020-12/schema","title":"Harness Spec v1","type":"object","additionalProperties":false,"required":["schema_version","candidate_id","base_dsh_commit","experiment_status","instruction_bundle","runtime_policy_reference","skill_bundle_references","memory_bootstrap_reference","provenance","content_hashes"],"properties":{"schema_version":{"const":"1.0.0"},"candidate_id":{"type":"string","pattern":"^[a-z0-9][a-z0-9_-]*$"},"parent_candidate_id":{"type":["string","null"]},"base_dsh_commit":{"const":"b150a551b8d465e31e418e1b2eaf5e79bbb7d28e"},"experiment_status":{"const":"INTEGRATION_ONLY"},"instruction_bundle":{"type":"object","additionalProperties":false,"properties":{"cordis_patch":{"type":"string"}},"required":["cordis_patch"]},"runtime_policy_reference":{"type":"string"},"skill_bundle_references":{"type":"array","items":{"type":"string"}},"memory_bootstrap_reference":{"type":["string","null"]},"provenance":{"type":"object","additionalProperties":false,"required":["source","created_by","purpose"],"properties":{"source":{"type":"string"},"created_by":{"type":"string"},"purpose":{"const":"DSH_HARBOR_ADAPTER_INTEGRATION_ONLY"}}},"content_hashes":{"type":"object","additionalProperties":{"type":"string"}}}}
