{"schema_version":"1.0.0","candidate_id":"adapter_smoke_h0","parent_candidate_id":null,"base_dsh_commit":"b150a551b8d465e31e418e1b2eaf5e79bbb7d28e","experiment_status":"INTEGRATION_ONLY","instruction_bundle":{"cordis_patch":"plugins:\n  - id: llm\n    config:\n      provider: deepseek-official\n      model: deepseek-v4-pro\n      thinking: enabled\n      reasoningEffort: high\n"},"runtime_policy_reference":"dsh_runtime_isolation_v1","skill_bundle_references":[],"memory_bootstrap_reference":null,"provenance":{"source":"M1C.1","created_by":"deterministic_materializer_v1","purpose":"DSH_HARBOR_ADAPTER_INTEGRATION_ONLY"},"content_hashes":{}}
